

Enter user-name: system
Enter password:
Last Successful login time: Wed May 22 2024 11:35:33 +05:30

Connected to:
Oracle Database 21c Express Edition Release 21.0.0.0.0 - Production
Version 21.3.0.0.0




SQL> CREATE TYPE addr_ty AS OBJECT
  2  (street varchar2(60),
  3  city varchar2(30),
  4  state char(2),
  5  zip varchar(9));
  6  /

Type created.

SQL> CREATE TYPE person_ty AS OBJECT
  2  (name varchar2(25),
  3  address addr_ty);
  4  /

Type created.

SQL> CREATE TYPE emp_ty AS OBJECT
  2  (empt_id varchar2(9),
  3  person person_ty);
  4  /

Type created.

SQL> CREATE TYPE EMP_OO
  2  (full_emp emp_ty);
  3  /

Warning: Type created with compilation errors.

SQL> CREATE TABLE EMP_OO
  2  (full_emp emp_ty);
CREATE TABLE EMP_OO
             *
ERROR at line 1:
ORA-00955: name is already used by an existing object


SQL> DROP TYPE EMP_OO;

Type dropped.

SQL> CREATE TABLE EMP_OO
  2  (full_emp emp_ty);

Table created.

SQL> INSERT INTO emp_oo VALUES
  2  (emp_ty('100', person
  3             /
(emp_ty('100', person
                    *
ERROR at line 2:
ORA-00907: missing right parenthesis


SQL> INSERT INTO emp_oo VALUES
  2  (emp_tyI('100',
  3             person_ty('Ram',
  4             addr_ty('1000 TU',
  5             'Patiala', 'PB', '147001'))));
(emp_tyI('100',
 *
ERROR at line 2:
ORA-00904: "EMP_TYI": invalid identifier


SQL> INSERT INTO emp_oo VALUES
  2  (emp_ty('100',
  3             person_ty('Ram',
  4             addr_ty('1000 TU',
  5             'Patiala', 'PB', '147001'))));

1 row created.

SQL> INSERT INTO emp_oo VALUES
  2  (emp_ty('101',
  3             person_ty('Sham',
  4             addr_ty('1001 TU',
  5             'Patiala', 'PB', '147001'))));

1 row created.

SQL> select * from emp_oo;

FULL_EMP(EMPT_ID, PERSON(NAME, ADDRESS(STREET, CITY, STATE, ZIP)))
--------------------------------------------------------------------------------
EMP_TY('100', PERSON_TY('Ram', ADDR_TY('1000 TU', 'Patiala', 'PB', '147001')))
EMP_TY('101', PERSON_TY('Sham', ADDR_TY('1001 TU', 'Patiala', 'PB', '147001')))

SQL> desc emp_oo;
 Name                                      Null?    Type
 ----------------------------------------- -------- ----------------------------
 FULL_EMP                                           EMP_TY

SQL> select * from emp_oo;

FULL_EMP(EMPT_ID, PERSON(NAME, ADDRESS(STREET, CITY, STATE, ZIP)))
--------------------------------------------------------------------------------
EMP_TY('100', PERSON_TY('Ram', ADDR_TY('1000 TU', 'Patiala', 'PB', '147001')))
EMP_TY('101', PERSON_TY('Sham', ADDR_TY('1001 TU', 'Patiala', 'PB', '147001')))

SQL> select e.full_emp.empt_id ID,
  2  e.full_emp.person.name NAME,
  3  e.full_emp.person.address.city CITY
  4  FROM emp_oo e;

ID        NAME                      CITY
--------- ------------------------- ------------------------------
100       Ram                       Patiala
101       Sham                      Patiala

SQL> UPDATE emp_oo e set
  2  e.full_emp.person.name='Raj'
  3  where
  4  e.full_emp.empt_id='100';

1 row updated.

SQL> select e.full_emp.empt_id ID,
  2  e.full_emp.person.name NAME,
  3  e.full_emp.person.address.city CITY
  4  FROM emp_oo e;

ID        NAME                      CITY
--------- ------------------------- ------------------------------
100       Raj                       Patiala
101       Sham                      Patiala

SQL> create or replace type newemp_ty as object (firstname varchar2(25),
  2  lastname varchar2(25), birthdate date,
  3  member function AGE(BirthDate in DATE) return NUMBER)
  4  /

Type created.

SQL> create or replace type newemp_ty as object (firstname varchar2(25),
  2  ;
  3  /
create or replace type newemp_ty as object (firstname varchar2(25),
*
ERROR at line 1:
ORA-06545: PL/SQL: compilation error - compilation aborted
ORA-06550: line 2, column 1:
PLS-00103: Encountered the symbol ";" when expecting one of the following:
not pragma <an identifier>
<a double-quoted delimited-identifier> final instantiable
persistable current delete exists order overriding prior
static member constructor map
ORA-06550: line 0, column 0:
PLS-00565: NEWEMP_TY must be completed as a potential REF target (object type)


SQL> create or replace type body newemp_ty as
  2  member function AGE(BirthDate in DATE) return NUMBER is
  3  begin
  4     RETURN ROUND(SysDate - BirthDate);
  5  end;
  6  end;
  7  /

Type body created.

SQL> create table new_emp_oo
  2  (employee newemp_ty);

Table created.

SQL> insert into new_emp_oo values
  2  (newemp_ty('Ram', 'Lai', '12-Dec-1976'));

1 row created.

SQL> select e.employee,firstname, e.employee.age(e.employee.birthdate) from
  2  new_emp_oo;
select e.employee,firstname, e.employee.age(e.employee.birthdate) from
                             *
ERROR at line 1:
ORA-00904: "E"."EMPLOYEE"."AGE": invalid identifier


SQL> select * from new_emp_oo;

EMPLOYEE(FIRSTNAME, LASTNAME, BIRTHDATE)
--------------------------------------------------------------------------------
NEWEMP_TY('Ram', 'Lai', '12-DEC-76')

SQL> insert into new_emp_oo values
  2  (newemp_ty('Sham', 'Jack', '27-Mar-1976'));

1 row created.

SQL> select e.employee.firstname, e.employee.age(e.employee.birthdate) from
  2  new_emp_oo;
select e.employee.firstname, e.employee.age(e.employee.birthdate) from
                             *
ERROR at line 1:
ORA-00904: "E"."EMPLOYEE"."AGE": invalid identifier


SQL> select e.employee.firstname, e.employee.age(e.employee.birthdate) from
  2  new_emp_oo e;

EMPLOYEE.FIRSTNAME        E.EMPLOYEE.AGE(E.EMPLOYEE.BIRTHDATE)
------------------------- ------------------------------------
Ram                                                      17321
Sham                                                     17581

SQL> create table new_emp1 of emp_ty;

Table created.

SQL> CREATE TYPE emp_ty AS OBJECT
  2  (empt_id VARCHAR2(9),
  3  person person_ty);
  4  /
CREATE TYPE emp_ty AS OBJECT
            *
ERROR at line 1:
ORA-00955: name is already used by an existing object


SQL> insert into new_emp1 values('100', person_ty('raj', addr_ty('100 TU', 'Pta', 'Pb', '147001')));

1 row created.

SQL> select * from new_emp1;

EMPT_ID
---------
PERSON(NAME, ADDRESS(STREET, CITY, STATE, ZIP))
--------------------------------------------------------------------------------
100
PERSON_TY('raj', ADDR_TY('100 TU', 'Pta', 'Pb', '147001'))


SQL> select ref(p) from new_emp1 p;

REF(P)
--------------------------------------------------------------------------------
0000280209B828469264A542BC9DCF1F9BB3A65FA65A06F0CD5C7243559EFECB8C9A6F42DD004205
090000


SQL> create type new_dept_oo as OBJECT
  2  (depno number(3), dname varchar(20));
  3  /

Type created.

SQL> create table dept_table of new_dept_oo;

Table created.

SQL> insert into dept_table values(10, 'comp');

1 row created.

SQL> insert into dept_table values(20, 'chem');

1 row created.

SQL> insert into dept_table values(30, 'math');

1 row created.

SQL> select ref(p) from dept_table p;

REF(P)
--------------------------------------------------------------------------------
000028020912C15A35BF3343BC8786D5518241FB49F9381AC00F63424C9CA47899D01DE716004205
190000

0000280209DDDDFDB0DD1C451BAAF5E241A3CF899FF9381AC00F63424C9CA47899D01DE716004205
190001

0000280209A09CC1B8271F4234B4F3F86E6C0E14FFF9381AC00F63424C9CA47899D01DE716004205
190002


SQL> create table emp_test_fk(
  2  empno number(3),
  3  name varchar(10),
  4  dept ref new_dept_oo);

Table created.

SQL> desc empt_test_fk
ERROR:
ORA-04043: object empt_test_fk does not exist


SQL> desc empt_test_fk;
ERROR:
ORA-04043: object empt_test_fk does not exist


SQL> desc emp_test_fk
 Name                                      Null?    Type
 ----------------------------------------- -------- ----------------------------
 EMPNO                                              NUMBER(3)
 NAME                                               VARCHAR2(10)
 DEPT                                               REF OF NEW_DEPT_OO

SQL> set desc depth 2
SQL> desc emp_test_fk
 Name                                      Null?    Type
 ----------------------------------------- -------- ----------------------------
 EMPNO                                              NUMBER(3)
 NAME                                               VARCHAR2(10)
 DEPT                                               REF OF NEW_DEPT_OO
   DEPNO                                            NUMBER(3)
   DNAME                                            VARCHAR2(20)

SQL> insert into emp_test_fk
  2  select 100, 'raj', ref(p) from dept_table p where deptno=10;
select 100, 'raj', ref(p) from dept_table p where deptno=10
                                                  *
ERROR at line 2:
ORA-00904: "DEPTNO": invalid identifier


SQL> select 100, 'raj', ref(p) from dept_table p where depno=10;

       100 'RA
---------- ---
REF(P)
--------------------------------------------------------------------------------
       100 raj
000028020912C15A35BF3343BC8786D5518241FB49F9381AC00F63424C9CA47899D01DE716004205
190000


SQL> insert into emp_test_fk
  2  select 100, 'raj', ref(p) from dept_table p where depno=10;

1 row created.

SQL> insert into emp_test_fk
  2  select 101, 'sham', ref(p) from dept_table p where depno=20;

1 row created.

SQL> select * from emp_test_fk;

     EMPNO NAME
---------- ----------
DEPT
--------------------------------------------------------------------------------
       100 raj
000022020812C15A35BF3343BC8786D5518241FB49F9381AC00F63424C9CA47899D01DE716

       101 sham
0000220208DDDDFDB0DD1C451BAAF5E241A3CF899FF9381AC00F63424C9CA47899D01DE716


SQL> select empno, name, deref(e.dept) from emp_task_fk e;
select empno, name, deref(e.dept) from emp_task_fk e
                                       *
ERROR at line 1:
ORA-00942: table or view does not exist


SQL> select empno, name, deref(e.dept) from emp_test_fk e;

     EMPNO NAME
---------- ----------
DEREF(E.DEPT)(DEPNO, DNAME)
--------------------------------------------------------------------------------
       100 raj
NEW_DEPT_OO(10, 'comp')

       101 sham
NEW_DEPT_OO(20, 'chem')


SQL> select empno, name, deref(e.depth), deref(e.depth).depno depno, deref(e.depth).dname dname from emp_test_fk e;
select empno, name, deref(e.depth), deref(e.depth).depno depno, deref(e.depth).dname dname from emp_test_fk e
                                                                      *
ERROR at line 1:
ORA-00904: "E"."DEPTH": invalid identifier


SQL> select empno, name, deref(e.depth), deref(e.dept).depno depno, deref(e.dept).dname dname from emp_test_fk e;
select empno, name, deref(e.depth), deref(e.dept).depno depno, deref(e.dept).dname dname from emp_test_fk e
                          *
ERROR at line 1:
ORA-00904: "E"."DEPTH": invalid identifier


SQL> select empno, name, deref(e.dept), deref(e.dept).depno depno, deref(e.dept).dname dname from emp_test_fk e;

     EMPNO NAME
---------- ----------
DEREF(E.DEPT)(DEPNO, DNAME)
--------------------------------------------------------------------------------
     DEPNO DNAME
---------- --------------------
       100 raj
NEW_DEPT_OO(10, 'comp')
        10 comp

       101 sham
NEW_DEPT_OO(20, 'chem')
        20 chem

     EMPNO NAME
---------- ----------
DEREF(E.DEPT)(DEPNO, DNAME)
--------------------------------------------------------------------------------
     DEPNO DNAME
---------- --------------------


SQL> create table emp_table_fk
  2  (employee emp_ty,
  3  dept ref new_dept_oo);

Table created.

SQL> set describe depth 1
SQL> desc emp_table_fk
 Name                                      Null?    Type
 ----------------------------------------- -------- ----------------------------
 EMPLOYEE                                           EMP_TY
 DEPT                                               REF OF NEW_DEPT_OO

SQL> set describe depth 2
SQL> desc emp_table_fk
 Name                                      Null?    Type
 ----------------------------------------- -------- ----------------------------
 EMPLOYEE                                           EMP_TY
   EMPT_ID                                          VARCHAR2(9)
   PERSON                                           PERSON_TY
 DEPT                                               REF OF NEW_DEPT_OO
   DEPNO                                            NUMBER(3)
   DNAME                                            VARCHAR2(20)

SQL> set describe depth 3
SQL> desc emp_table_fk
 Name                                      Null?    Type
 ----------------------------------------- -------- ----------------------------
 EMPLOYEE                                           EMP_TY
   EMPT_ID                                          VARCHAR2(9)
   PERSON                                           PERSON_TY
     NAME                                           VARCHAR2(25)
     ADDRESS                                        ADDR_TY
 DEPT                                               REF OF NEW_DEPT_OO
   DEPNO                                            NUMBER(3)
   DNAME                                            VARCHAR2(20)

SQL> set describe depth 4
SQL> desc emp_table_fk
 Name                                      Null?    Type
 ----------------------------------------- -------- ----------------------------
 EMPLOYEE                                           EMP_TY
   EMPT_ID                                          VARCHAR2(9)
   PERSON                                           PERSON_TY
     NAME                                           VARCHAR2(25)
     ADDRESS                                        ADDR_TY
       STREET                                       VARCHAR2(60)
       CITY                                         VARCHAR2(30)
       STATE                                        CHAR(2)
       ZIP                                          VARCHAR2(9)
 DEPT                                               REF OF NEW_DEPT_OO
   DEPNO                                            NUMBER(3)
   DNAME                                            VARCHAR2(20)

SQL> insert into emp_table fk values(
  2  emp_ty(100, person_ty('ram', addr_ty('10 tu', 'pat', 'pb', '147001'))),
  3  (select REF(P)
  4  from dept_table P
  5  where depno=10
  6  ));
insert into emp_table fk values(
            *
ERROR at line 1:
ORA-00942: table or view does not exist


SQL> insert into emp_table_fk values(
  2  emp_ty(100, person_ty('ram', addr_ty('10 tu', 'pat', 'pb', '147001'))),
  3  (select REF(P)
  4  from dept_table P
  5  where depno=10
  6  ));

1 row created.

SQL> select * from emp_table_fk;

EMPLOYEE(EMPT_ID, PERSON(NAME, ADDRESS(STREET, CITY, STATE, ZIP)))
--------------------------------------------------------------------------------
DEPT
--------------------------------------------------------------------------------
EMP_TY('100', PERSON_TY('ram', ADDR_TY('10 tu', 'pat', 'pb', '147001')))
000022020812C15A35BF3343BC8786D5518241FB49F9381AC00F63424C9CA47899D01DE716


SQL> select e.employee.empt_id id, e.employee.person.name name,
  2  deref(e.dept), deref(e.dept).depno depno,
  3  deref(e.dept).dname dname
  4  from emp_table_fk e;

ID        NAME
--------- -------------------------
DEREF(E.DEPT)(DEPNO, DNAME)
--------------------------------------------------------------------------------
     DEPNO DNAME
---------- --------------------
100       ram
NEW_DEPT_OO(10, 'comp')
        10 comp